{
  "schemaVersion": 1,
  "id": "phase-2-sample",
  "metadata": {
    "status": "sample_not_final_dialogue",
    "startMinute": 1165,
    "endMinute": 1185,
    "requiredLocales": ["en"],
    "historicalReviewRequired": true,
    "culturalReviewRequired": true,
    "nativeRussianDialogueReviewRequired": true
  },
  "characters": [
    {
      "id": "sasha",
      "nameKey": "characters.sasha",
      "role": "player",
      "historicalStatus": "fictional-composite",
      "initial": {
        "present": true,
        "trust": 0,
        "agitation": 4,
        "publicCertainty": 20,
        "privatePressure": 8
      }
    },
    {
      "id": "galina",
      "nameKey": "characters.galina",
      "role": "manager",
      "historicalStatus": "fictional-composite",
      "initial": {
        "present": true,
        "trust": 4,
        "agitation": 5,
        "publicCertainty": 45,
        "privatePressure": 10
      }
    },
    {
      "id": "arkady",
      "nameKey": "characters.arkady",
      "role": "patron",
      "historicalStatus": "fictional-composite",
      "initial": {
        "present": true,
        "trust": 0,
        "agitation": 14,
        "publicCertainty": 82,
        "privatePressure": 18
      }
    },
    {
      "id": "lev",
      "nameKey": "characters.lev",
      "role": "patron",
      "historicalStatus": "fictional-composite",
      "initial": {
        "present": true,
        "trust": 1,
        "agitation": 10,
        "publicCertainty": 70,
        "privatePressure": 16
      }
    },
    {
      "id": "nikolai",
      "nameKey": "characters.nikolai",
      "role": "patron",
      "historicalStatus": "fictional-composite",
      "initial": {
        "present": true,
        "trust": 0,
        "agitation": 12,
        "publicCertainty": 76,
        "privatePressure": 20
      }
    },
    {
      "id": "gennady",
      "nameKey": "characters.gennady",
      "role": "patron",
      "historicalStatus": "fictional-composite",
      "initial": {
        "present": true,
        "trust": 1,
        "agitation": 16,
        "publicCertainty": 74,
        "privatePressure": 22
      }
    }
  ],
  "claims": [
    {
      "id": "claim_gennady_workers_outlast_bosses",
      "speakerId": "gennady",
      "context": "public",
      "repeatable": true,
      "socialRisk": "low",
      "contradicts": [],
      "historicalLedgerIds": []
    },
    {
      "id": "claim_arkady_emergency_may_be_necessary",
      "speakerId": "arkady",
      "context": "public",
      "repeatable": true,
      "socialRisk": "low",
      "contradicts": ["claim_arkady_opposed_from_start"],
      "historicalLedgerIds": []
    },
    {
      "id": "claim_arkady_opposed_from_start",
      "speakerId": "arkady",
      "context": "public",
      "repeatable": true,
      "socialRisk": "low",
      "contradicts": ["claim_arkady_emergency_may_be_necessary"],
      "historicalLedgerIds": []
    },
    {
      "id": "claim_gennady_concealed_shop_accident",
      "speakerId": "gennady",
      "context": "private",
      "repeatable": true,
      "socialRisk": "high",
      "contradicts": [],
      "historicalLedgerIds": []
    }
  ],
  "chapters": [
    {
      "id": "chapter_sample_room_rewrites",
      "titleKey": "chapters.sample_room_rewrites",
      "startsAt": 1165
    }
  ],
  "events": [
    {
      "id": "event_sample_attention",
      "kind": "broadcast",
      "dueMinute": 1182,
      "priority": 100,
      "effects": [
        {
          "type": "set-event-status",
          "eventId": "event_sample_attention",
          "status": "announced"
        },
        { "type": "set-object-state", "objectId": "television", "state": "bulletin" },
        { "type": "set-object-state", "objectId": "radio_music", "state": "silent" },
        {
          "type": "open-attention",
          "windowId": "attention_sample_three_way"
        }
      ],
      "historicalLedgerIds": [],
      "wordingPolicy": "original-fictionalized"
    }
  ],
  "attentionWindows": [
    {
      "id": "attention_sample_three_way",
      "eventId": "event_sample_attention",
      "promptKey": "attention.sample.prompt",
      "selectionMode": "primary-plus-fragment",
      "timeoutMode": "none",
      "offers": [
        {
          "id": "offer_sample_television",
          "targetId": "television",
          "labelKey": "attention.sample.television",
          "gotoNodeId": "sample_attention_tv_direct",
          "outcomes": [
            {
              "offerId": "offer_sample_television",
              "outcome": "direct",
              "knowledgeId": "knowledge_sample_tv_signal",
              "sourceEventId": "event_sample_attention"
            },
            {
              "offerId": "offer_sample_arkady_rewrite",
              "outcome": "fragment",
              "knowledgeId": "knowledge_arkady_rewrite",
              "sourceCharacterId": "arkady"
            },
            {
              "offerId": "offer_sample_galina_aside",
              "outcome": "missed",
              "knowledgeId": "knowledge_galina_aside",
              "sourceCharacterId": "galina"
            }
          ]
        },
        {
          "id": "offer_sample_arkady_rewrite",
          "targetId": "arkady",
          "labelKey": "attention.sample.arkady",
          "gotoNodeId": "sample_attention_arkady_direct",
          "outcomes": [
            {
              "offerId": "offer_sample_television",
              "outcome": "fragment",
              "knowledgeId": "knowledge_sample_tv_signal",
              "sourceEventId": "event_sample_attention"
            },
            {
              "offerId": "offer_sample_arkady_rewrite",
              "outcome": "direct",
              "knowledgeId": "knowledge_arkady_rewrite",
              "sourceCharacterId": "arkady"
            },
            {
              "offerId": "offer_sample_galina_aside",
              "outcome": "missed",
              "knowledgeId": "knowledge_galina_aside",
              "sourceCharacterId": "galina"
            }
          ]
        },
        {
          "id": "offer_sample_galina_aside",
          "targetId": "galina",
          "labelKey": "attention.sample.galina",
          "gotoNodeId": "sample_attention_galina_direct",
          "outcomes": [
            {
              "offerId": "offer_sample_television",
              "outcome": "fragment",
              "knowledgeId": "knowledge_sample_tv_signal",
              "sourceEventId": "event_sample_attention"
            },
            {
              "offerId": "offer_sample_arkady_rewrite",
              "outcome": "missed",
              "knowledgeId": "knowledge_arkady_rewrite",
              "sourceCharacterId": "arkady"
            },
            {
              "offerId": "offer_sample_galina_aside",
              "outcome": "direct",
              "knowledgeId": "knowledge_galina_aside",
              "sourceCharacterId": "galina"
            }
          ]
        }
      ]
    }
  ],
  "interactionObjects": [
    {
      "id": "prop_galina_stock_notebook",
      "labelKey": "objects.stock_notebook",
      "initialState": "closed",
      "states": ["closed", "open"]
    },
    {
      "id": "prop_gennady_glass",
      "labelKey": "objects.gennady_glass",
      "initialState": "stable",
      "states": ["stable", "cleared", "overturned"]
    },
    {
      "id": "prop_gennady_factory_photo",
      "labelKey": "objects.factory_photo",
      "initialState": "covered",
      "states": ["covered", "face_up", "face_down"]
    },
    {
      "id": "television",
      "labelKey": "objects.television",
      "initialState": "music_low",
      "states": ["music_low", "signal_unstable", "signal_clear", "bulletin", "after_report"]
    },
    {
      "id": "television_volume",
      "labelKey": "objects.television_volume",
      "initialState": "low",
      "states": ["muted", "low", "normal"]
    },
    {
      "id": "radio_music",
      "labelKey": "objects.radio_music",
      "initialState": "instrumental_low",
      "states": ["instrumental_low", "lowered", "silent"]
    },
    {
      "id": "prop_nikolai_tea",
      "labelKey": "objects.nikolai_tea",
      "initialState": "waiting",
      "states": ["waiting", "served", "untouched"]
    }
  ],
  "dialogueGraphs": [
    {
      "id": "graph_sample_room_rewrites",
      "entryNodeId": "sample_galina_shift_terms",
      "nodes": [
        {
          "id": "sample_galina_shift_terms",
          "speakerId": "galina",
          "textKey": "dialogue.sample.galina_shift_terms",
          "requires": [],
          "onEnter": [
            {
              "type": "set-object-state",
              "objectId": "prop_galina_stock_notebook",
              "state": "open"
            }
          ],
          "choices": [
            {
              "id": "choice_sample_observe_room",
              "textKey": "choices.sample.observe_room",
              "kind": "observe",
              "requires": [],
              "effects": [
                { "type": "advance-time", "minutes": 1, "reason": "read the room" },
                { "type": "goto", "nodeId": "sample_sasha_reads_room" }
              ]
            },
            {
              "id": "choice_sample_ask_tasks",
              "textKey": "choices.sample.ask_tasks",
              "kind": "speak",
              "requires": [],
              "effects": [
                { "type": "advance-time", "minutes": 1, "reason": "take the handoff" },
                { "type": "goto", "nodeId": "sample_opening_maintenance" }
              ]
            },
            {
              "id": "choice_sample_ask_galina_tired",
              "textKey": "choices.sample.ask_galina_tired",
              "kind": "speak",
              "requires": [],
              "effects": [
                { "type": "advance-time", "minutes": 1, "reason": "check on Galina" },
                { "type": "goto", "nodeId": "sample_galina_tired_answer" }
              ]